{
  "schema": "postfiat-constitutional-conformance-packet-v1",
  "conformance_id": "vc-cobalt-governance-001-conformance-001",
  "conformance_version": 1,
  "status": "accepted",
  "conformance_scope": "cobalt_governance",
  "created_at": "2026-05-24T00:00:00Z",
  "target_decision_ref": {
    "decision_id": "vc-cobalt-governance-001-decision-001",
    "decision_path": "docs/governance/agent/fixtures/verifiable_constitution/cobalt_constitutional_decision_packet.json",
    "decision_file_sha3_384": "3c4073c9b7eb9ead951f25bb1de56a6bb5d8d8661e663e1585c255dcd29df3be5ff3e3d09ed4c12fe4bd82b6d5a183c0",
    "decision_canonical_hash": "b292b88fc4143ef9d34327997ba1d107c6bb47bdd1837a15a20af684b9939e7758d3c6cfa55f8723debac79b9f91a396",
    "decision_schema_path": "docs/governance/agent/constitutional_decision_packet_schema.json",
    "decision_schema_sha3_384": "8075b9d26086776837157a1e4002e855ad587b437c2d2a21cdb78b231543abcb747b0fd3c7066fc3aacbd4f027d56c59"
  },
  "conformance_disposition": {
    "selected": "hold_no_live_effect",
    "decision_status_at_mapping": "candidate",
    "default_action": "preserve_status_quo",
    "rationale": "The Cobalt decision preserves existing hard gates and its own authority boundary requires a later Cobalt or release gate before live effect. The accepted conformance action is therefore docs/tests/report binding only, with no registry mutation, no Cobalt submission, no sidecar activation, no model promotion, and no authority transfer."
  },
  "implementation_mappings": [
    {
      "mapping_id": "document-conformance-boundary",
      "target_type": "docs",
      "target_path": "docs_site/governance/verifiable-constitution-plan.md",
      "effect": "docs_only",
      "decision_json_pointers": [
        "/selected_option",
        "/authority_boundary",
        "/fallback"
      ],
      "evidence_ref_paths": [
        "cobalt.registry_transition_rules_hash",
        "cobalt.dry_run_no_mutation_report_hash",
        "cobalt.override_detection_report_hash"
      ],
      "required_for_conformance": true,
      "requires_later_authorization": false,
      "live_effect": false,
      "rationale": "The plan must state that the accepted Cobalt decision maps to documentation and verification gates only until a later governed action authorizes live effect."
    },
    {
      "mapping_id": "verify-decision-replay",
      "target_type": "test",
      "target_path": "scripts/verifiable-constitution-internal-decision-replay",
      "effect": "test_gate",
      "decision_json_pointers": [
        "/decision_generation",
        "/selected_option",
        "/implementation_consequences"
      ],
      "evidence_ref_paths": [
        "cobalt.replay_bundle_root",
        "cobalt.adversarial_packet_coverage",
        "cobalt.rollback_supersession_evidence_hash"
      ],
      "required_for_conformance": true,
      "requires_later_authorization": false,
      "live_effect": false,
      "rationale": "The replay verifier remains a required local gate before any conformance packet can be considered accepted."
    },
    {
      "mapping_id": "bind-model-receipt-roots",
      "target_type": "report",
      "target_path": "reports/verifiable-constitution/vc-022-cross-machine-model-receipts-report.json",
      "effect": "report_gate",
      "decision_json_pointers": [
        "/decision_generation",
        "/authority_boundary/default_conformance_requires_later_gate",
        "/fallback"
      ],
      "evidence_ref_paths": [
        "cobalt.replay_bundle_root",
        "cobalt.override_detection_report_hash",
        "cobalt.rollback_supersession_evidence_hash"
      ],
      "required_for_conformance": true,
      "requires_later_authorization": false,
      "live_effect": false,
      "rationale": "The conformance packet binds the existing cross-machine constitutional model receipt roots as evidence for replayability, while keeping them advisory until a later governed activation packet."
    },
    {
      "mapping_id": "bind-conformance-schema-and-fixture",
      "target_type": "schema",
      "target_path": "docs/governance/agent/constitutional_conformance_packet_schema.json",
      "effect": "schema_validation",
      "decision_json_pointers": [
        "/implementation_consequences/0",
        "/implementation_consequences/1",
        "/implementation_consequences/2"
      ],
      "evidence_ref_paths": [
        "cobalt.registry_transition_rules_hash",
        "cobalt.dry_run_no_mutation_report_hash",
        "cobalt.override_detection_report_hash"
      ],
      "required_for_conformance": true,
      "requires_later_authorization": false,
      "live_effect": false,
      "rationale": "A typed conformance packet converts the decision's implementation consequences into a machine-checkable docs/tests/gates mapping."
    },
    {
      "mapping_id": "hold-live-registry-effect",
      "target_type": "governance_gate",
      "target_path": "future-cobalt-or-release-gate",
      "effect": "future_authorization_required",
      "decision_json_pointers": [
        "/authority_boundary/default_conformance_requires_later_gate",
        "/implementation_consequences/2",
        "/invalidation_criteria/2"
      ],
      "evidence_ref_paths": [
        "cobalt.registry_transition_rules_hash",
        "cobalt.dry_run_no_mutation_report_hash",
        "cobalt.override_detection_report_hash"
      ],
      "required_for_conformance": true,
      "requires_later_authorization": true,
      "live_effect": false,
      "rationale": "The conformance packet deliberately records that any live validator-registry, Cobalt-amendment, sidecar, model-promotion, or authority-transfer effect is held until a separate future-authorized gate."
    }
  ],
  "verification_commands": [
    {
      "command": "scripts/verifiable-constitution-conformance-packet-validate --verify-report",
      "purpose": "Verify the accepted conformance packet, target decision hashes, authority boundary, implementation mappings, and conformance root.",
      "expected_result": "pass",
      "required": true,
      "live_effect": false
    },
    {
      "command": "scripts/verifiable-constitution-model-receipt-conformance-binding --verify-report",
      "purpose": "Verify that the conformance packet binds the available H100/H200 model receipt roots, full-vocabulary root, decision packet root, implementation mappings, rollback path, and Cobalt dry-run binding.",
      "expected_result": "pass",
      "required": true,
      "live_effect": false
    },
    {
      "command": "scripts/verifiable-constitution-internal-decision-replay --verify-report",
      "purpose": "Verify the target Cobalt decision replay report and one parsed decision hash.",
      "expected_result": "pass",
      "required": true,
      "live_effect": false
    },
    {
      "command": "scripts/verifiable-constitution-cobalt-question --verify-report",
      "purpose": "Verify the underlying Cobalt constitutional question remains bound to closed options and no live authority.",
      "expected_result": "pass",
      "required": true,
      "live_effect": false
    },
    {
      "command": "scripts/validator-evidence-fixtures-validate",
      "purpose": "Keep the validator-evidence fixture suite passing while the conformance lane is added.",
      "expected_result": "pass",
      "required": true,
      "live_effect": false
    },
    {
      "command": "scripts/docs-site-build",
      "purpose": "Build the docs site after updating the Verifiable Constitution plan.",
      "expected_result": "pass",
      "required": true,
      "live_effect": false
    }
  ],
  "model_receipt_bindings": [
    {
      "binding_id": "vc022_privacy_full_vocab",
      "question_id": "vc-privacy-architecture-001",
      "binding_scope": "non_validator_constitutional_prompt",
      "source_report_path": "reports/verifiable-constitution/vc-022-cross-machine-model-receipts-report.json",
      "source_report_sha3_384": "448d56f393aebee9f5617a47ca288d3f82e968b40f46dfc08af56c5e5fb064b672129b6524e655ee9cf170503b8992e1",
      "source_report_schema": "postfiat-verifiable-constitution-cross-machine-receipts-report-v1",
      "cross_machine_receipt_root": "ea19d6788e18f947b0f4156b0df7ffae2a38915a1b154f20a5c7632a968c99cddc91ce5e69f36c3ad296b12d5051b724",
      "parsed_output_hash": "29b94f774e6a827b2461146472349527d2ce7c5b12e875668bd7465d3a854022518980e178787c753f01ed5df2b14cbf",
      "top_logprob_commitment_root": "f168514f56ee4e10bf1bbb2f634804bf956c68699fca2fd08b77ac146298223f6b1f8038286fbbfd17ccc8acf5db9d1a",
      "full_vocab_logprob_vector_root": "47937e0f19da588d92d46b677de95070134d1203575272add0f2af9d024361bc",
      "classification": "green-full-vocab-universal",
      "receipt_report_refs": [
        {
          "report_path": "reports/verifiable-constitution/vc-021-live-model-receipt-h100-report.json",
          "report_sha3_384": "1654c75b019143e5ad29b8703ac79c85e84e56465b1ff44aac31f3d4a4cdcdc13d79521aa0600f9bc91a24baaf74a4a9",
          "report_kind": "live_model_receipt_report",
          "hardware_class": "NVIDIA H100 NVL",
          "receipt_roots": [
            "b729aa24048918629dbbd162e55d07967184558e8d3adcf5fee4c3a31d4c7f14504e8f70c6fae7c69d9ab013821a7a9b",
            "d1fbd1bbe05020517be67c6d62a130cbb3ebe02c925d446bc2e3f46ef299c1a9bd372e4358593409fbcd6475aac1b860",
            "3b56bbfa200ffd29ef4f9c6240ae3d46416565de8c7e5b229a2806d19f86b85a44c36cea2d7dcc54d59a581d820bcf66",
            "d7f3f5c44187f754d554c1cd08dea96b40d51b4d5c7c729b4bd4cc26e964282431bb37e77b0f328376634d68c4d2aa57",
            "b2c2724c8cbb221b28daee13b4f7620fa916477d404542da86339b6db6e8ad47bb3767e61bf344956d650c1bc37d17a0"
          ],
          "parsed_output_hash": "29b94f774e6a827b2461146472349527d2ce7c5b12e875668bd7465d3a854022518980e178787c753f01ed5df2b14cbf",
          "top_logprob_commitment_root": "f168514f56ee4e10bf1bbb2f634804bf956c68699fca2fd08b77ac146298223f6b1f8038286fbbfd17ccc8acf5db9d1a",